{
  "$schema": "https://lc-json.org/1.0/course.schema.json",
  "documentType": "course",
  "specVersion": "1.0",
  "sourceCourseId": "550e8400-e29b-41d4-a716-446655440099",
  "version": "1.0",
  "title": "Beginning English for Spanish Speakers",
  "subtitle": "A course for beginners with notes in Spanish",
  "description": "An A1-level English course for adult Spanish-speaking learners. Vocabulary, grammar, and reading introduced gradually; key terms and instructions also given in Spanish.",
  "authors": [
    "Dr. Jane Smith"
  ],
  "language": "en",
  "supportLanguage": "es",
  "tags": [
    "language:english",
    "level:A1",
    "audience:spanish-speakers"
  ],
  "units": []
}
