{
  "$schema": "https://lc-json.org/1.0-rc.1/course.schema.json",
  "documentType": "course",
  "specVersion": "1.0",
  "title": "Valid course — HTML safety profile §7 media (video + track)",
  "version": "1.0",
  "language": "en",
  "units": [
    {
      "globalId": "11111111-1111-4111-8111-111111111111",
      "title": "Unit 1",
      "lessons": [
        {
          "globalId": "22222222-2222-4222-8222-222222222222",
          "title": "Lesson 1",
          "items": [
            {
              "type": "content",
              "globalId": "33333333-3333-4333-8333-333333333333",
              "title": "Lecture with captions",
              "html": "<h2>Welcome</h2>\n<p>The lecture below is captioned in English.</p>\n<video src=\"https://example.org/media/lecture.mp4\" controls poster=\"https://example.org/media/lecture-thumb.jpg\" preload=\"metadata\" width=\"640\">\n  <track src=\"https://example.org/media/lecture.vtt\" kind=\"captions\" srclang=\"en\" label=\"English\" default />\n</video>"
            }
          ]
        }
      ]
    }
  ]
}
